<?xml version="1.0" encoding="UTF-8"?>


<!DOCTYPE data SYSTEM 'coursesDTD.dtd'>
<data>
    <!-- Monday -->
    <day day="Monday">
            <time startTime="1:30" endTime="3:20">
                    <course course="ACIT4770">
                            <room>SE12-306</room>
                            <instructor>Trevor Lord</instructor>
                            <type>Lecture</type>
                    </course>
            </time>
            <time startTime="3:30" endTime="4:20">
                    <course course="ACIT4910">
                            <room>SW9-206</room>
                            <instructor>Richard Chau</instructor>
                            <type>Lecture</type>
                    </course>
            </time>
            <time startTime="4:30" endTime="5:20">
                    <course course="ACIT4650">
                            <room>SE6-205</room>
                            <instructor>Medhat Elmasry</instructor>
                            <type>Lecture</type>
                    </course>
            </time>
    </day>
    <!-- Tuesday -->
    <day day="Tuesday">
            <time startTime="10:30" endTime="12:20">
                    <course course="ACIT4620">
                            <room>SE12-306</room>
                            <instructor>Bethany Edmunds</instructor>
                            <type>Lab</type>
                    </course>
            </time>
            <time startTime="12:30" endTime="1:20">
                    <course course="ACIT4650">
                            <room>SW9-206</room>
                            <instructor>Medhat Elmasry</instructor>
                            <type>Lecture</type>
                    </course>
            </time>
            <time startTime="1:30" endTime="3:20">
                    <course course="ACIT4650">
                            <room>SE12-306</room>
                            <instructor>Medhat Elmasry</instructor>
                            <type>Lab</type>
                    </course>
            </time>
            <time startTime="3:30" endTime="5:20">
                    <course course="ACIT4620">
                            <room>SW3-3615</room>
                            <instructor>Bethany Edmunds</instructor>
                            <type>Lecture</type>
                    </course>
            </time>
    </day>
    <!-- Wednesday -->
    <day day="Wednesday">
            <time startTime="10:30" endTime="12:20">
                    <course course="ACIT4660">
                            <room>SE12-306</room>
                            <instructor>Steve Fabiszewski</instructor>
                            <type>Lab</type>
                    </course>
            </time>
            <time startTime="12:30" endTime="2:20">
                    <course course="ACIT4850">
                            <room>SW3-1750</room>
                            <instructor>James Parry</instructor>
                            <type>Lecture</type>
                    </course>
            </time>
    </day>
    <!-- Thursday -->
    <day day="Thursday">
        <time startTime="9:30" endTime="10:20">
            <course course="ACIT4910">
                <room>SW5-1840</room>
                <instructor>Richard Chau</instructor>
                <type>Lecture</type>
            </course>
        </time>
        <time startTime="10:30" endTime="12:20">
            <course course="ACIT4850">
                <room>SE12-320</room>
                <instructor>James Parry</instructor>
                <type>Lab</type>
            </course>
        </time>
        <time startTime="1:30" endTime="3:20">
            <course course="ACIT4910">
                <room>SE12-306</room>
                <instructor>Richar Chau</instructor>
                <type>Lab</type>
            </course>
        </time>
    </day>
    <!-- Friday -->
    <day day="Friday">
        <time startTime="8:30" endTime="10:20">
            <course course="ACIT4660">
                <room>SW9-206</room>
                <instructor>Steve Fabiszewski</instructor>
                <type>Lecture</type>
            </course>
        </time>
    </day>
</data>