<?xml version="1.0" encoding="UTF-8"?>


<!DOCTYPE data SYSTEM 'coursesDTD.dtd'>
<data>
<!-- 8:30 Classes -->
<time startTime="8:30">
	<day day="Friday">
            <booking>
		<course>ACIT4660</course>
			<room>SW9-206</room>
			<instructor>Steve Fabiszewski</instructor>
			<type>Lecture</type>
			<endTime>10:20</endTime>
            </booking>
	</day>
</time>
<!-- 9:30 Classes -->
<time startTime="9:30">
	<day day="Thursday">
            <booking>
		<course>ACIT4910</course>
			<room>SW5-1840</room>
			<instructor>Richard Chau</instructor>
			<type>Lecture</type>
			<endTime>10:20</endTime>
            </booking>
	</day>
	<day day="Friday">
            <booking>
		<course>ACIT4660</course>
			<room>SW9-206</room>
			<instructor>Steve Fabiszewski</instructor>
			<type>Lecture</type>
			<endTime>10:20</endTime>
            </booking>
	</day>
</time>
<!-- 10:30 Classes -->
<time startTime="10:30">
	<day day="Tuesday">
            <booking>
		<course>ACIT4620</course>
			<room>SE12-306</room>
			<instructor>Bethany Edmunds</instructor>
			<type>Lab</type>
			<endTime>12:20</endTime>
            </booking>
	</day>
	<day day="Wednesday">
            <booking>
		<course>ACIT4660</course>
			<room>SE12-306</room>
			<instructor>Steve Fabiszewski</instructor>
			<type>Lab</type>
			<endTime>12:20</endTime>
            </booking>
	</day>
	<day day="Thursday">
            <booking>
		<course>ACIT4850</course>
			<room>SE12-320</room>
			<instructor>James Parry</instructor>
			<type>Lab</type>
			<endTime>12:20</endTime>
            </booking>
	</day>
</time>
<!-- 11:30 Classes -->
<time startTime="11:30">
	<day day="Tuesday">
            <booking>
		<course>ACIT4620</course>
			<room>SE12-306</room>
			<instructor>Bethany Edmunds</instructor>
			<type>Lab</type>
			<endTime>12:20</endTime>
            </booking>
	</day>
	<day day="Wednesday">
            <booking>
		<course>ACIT4660</course>
			<room>SE12-306</room>
			<instructor>Steve Fabiszewski</instructor>
			<type>Lab</type>
			<endTime>12:20</endTime>
            </booking>
	</day>
	<day day="Thursday">
            <booking>
                <course>ACIT4850</course>
			<room>SE12-320</room>
			<instructor>James Parry</instructor>
			<type>Lab</type>
			<endTime>12:20</endTime>
            </booking>
	</day>
</time>
<!-- 12:30 Classes -->
<time startTime="12:30">
	<day day="Tuesday">
            <booking>
		<course>ACIT4650</course>
			<room>SW9-206</room>
			<instructor>Medhat Elmasry</instructor>
			<type>Lecture</type>
			<endTime>1:20</endTime>
            </booking>
	</day>
	<day day="Wednesday">
            <booking>
                <course>ACIT4850</course>
			<room>SW3-1750</room>
			<instructor>James Parry</instructor>
			<type>Lecture</type>
			<endTime>2:20</endTime>
            </booking>
	</day>
</time>
<!-- 1:30 Classes -->
<time startTime="1:30">
	<day day="Monday">
            <booking>
                <course>ACIT4770</course>
			<room>SE12-306</room>
			<instructor>Trevor Lord</instructor>
			<type>Lecture</type>
			<endTime>3:20</endTime>
            </booking>
	</day>
	<day day="Tuesday">
            <booking>
		<course>ACIT4650</course>
                <room>SE12-306</room>
                <instructor>Medhat Elmasry</instructor>
                <type>Lab</type>
                <endTime>3:20</endTime>
            </booking>
	</day>
	<day day="Wednesday">
            <booking>
                    <course>ACIT4850</course>
                    <room>SW3-1750</room>
                    <instructor>James Parry</instructor>
                    <type>Lecture</type>
                    <endTime>2:20</endTime>
            </booking>
	</day>
	<day day="Thursday">
            <booking>
		<course>ACIT4910</course>
                <room>SE12-306</room>
                <instructor>Richard Chau</instructor>
                <type>Lab</type>
                <endTime>3:20</endTime>
            </booking>
	</day>
</time>
<!-- 2:30 Classes -->
<time startTime="2:30">
	<day day="Monday">
            <booking>
		<course>ACIT4770</course>
                <room>SE12-306</room>
                <instructor>Trevor Lord</instructor>
                <type>Lecture</type>
                <endTime>3:20</endTime>
            </booking>
	</day>
	<day day="Tuesday">
            <booking>
		<course>ACIT4650</course>
                <room>SE12-306</room>
                <instructor>Medhat Elmasry</instructor>
                <type>Lab</type>
                <endTime>3:20</endTime>
            </booking>
	</day>
	<day day="Thursday">
            <booking>
		<course>ACIT4910</course>
                <room>SE12-306</room>
                <instructor>Richard Chau</instructor>
                <type>Lab</type>
                <endTime>3:20</endTime>
            </booking>
	</day>
</time>
<!-- 3:30 Classes -->
<time startTime="3:30">
	<day day="Monday">
            <booking>
                <course>ACIT4910</course>
                <room>SW9-206</room>
                <instructor>Richard Chau</instructor>
                <type>Lecture</type>
                <endTime>4:20</endTime>
            </booking>
	</day>
	<day day="Tuesday">
            <booking>
		<course>ACIT4620</course>
                <room>SW3-3615</room>
                <instructor>Bethany Edmunds</instructor>
                <type>Lecture</type>
                <endTime>5:20</endTime>
            </booking>
	</day>
</time>
<!-- 4:30 Classes -->
<time startTime="4:30">
	<day day="Monday">
            <booking>
                <course>ACIT4650</course>
                <room>SE6-205</room>
                <instructor>Medhat Elmasry</instructor>
                <type>Lecture</type>
                <endTime>5:20</endTime>
            </booking>
	</day>
	<day day="Tuesday">
            <booking>
                <course>ACIT4620</course>
                <room>SW3-3615</room>
                <instructor>Bethany Edmunds</instructor>
                <type>Lecture</type>
                <endTime>5:20</endTime>
            </booking>
	</day>
</time>
</data>